{
  "version": 1,
  "generatedAt": 1791650000,
  "basket": {
    "weightCap": {
      "entry": "bitcoin",
      "max": 0.6
    },
    "entries": [
      {
        "id": "bitcoin",
        "label": "BTC",
        "algorithm": "sha256",
        "chains": [
          {
            "chain": "btc-mainnet",
            "hashesPerDifficulty": 4294967296
          }
        ]
      },
      {
        "id": "monero",
        "label": "XMR",
        "algorithm": "randomx",
        "chains": [
          {
            "chain": "xmr-mainnet",
            "hashesPerDifficulty": 1
          }
        ]
      }
    ]
  },
  "electricity": {
    "windowDays": 30,
    "regions": [
      {
        "id": "de-lu",
        "label": "Germany-Luxembourg day-ahead",
        "attribution": "Bundesnetzagentur | SMARD.de, CC BY 4.0",
        "lastContributed": 1791590400
      }
    ],
    "minDays": 10
  },
  "series": {
    "price/btc-mainnet": {
      "unit": "USD",
      "source": "relay, smoothed over several providers",
      "asOf": 1791649800,
      "stale": false,
      "points": [
        [
          1791649200,
          82900.5
        ],
        [
          1791649800,
          82934.2
        ]
      ]
    },
    "price/usdc": {
      "unit": "USD",
      "source": "relay, smoothed over several providers",
      "asOf": 1791649800,
      "stale": false,
      "points": [
        [
          1791649800,
          0.9999
        ]
      ]
    },
    "marketCap/btc-mainnet": {
      "unit": "USD",
      "source": "price x coins in existence",
      "asOf": 1791649800,
      "stale": false,
      "points": [
        [
          1791649800,
          1650000000000
        ]
      ]
    },
    "hashrate/btc-mainnet": {
      "unit": "hashes/s",
      "source": "chain statistics",
      "asOf": 1791648000,
      "stale": false,
      "points": [
        [
          1791648000,
          925158233100000000000
        ]
      ]
    },
    "minerRevenue/btc-mainnet": {
      "unit": "coins/s including fees, after miner allocations",
      "source": "illustrative fee-inclusive 24h receipts",
      "asOf": 1791648000,
      "stale": false,
      "points": [
        [
          1791648000,
          0.005333333333333333
        ]
      ]
    },
    "efficiency/sha256": {
      "unit": "hashes/kWh",
      "source": "Cambridge CBECI, curated",
      "asOf": 1791504000,
      "stale": false,
      "points": [
        [
          1788220800,
          193642085000000000
        ]
      ]
    },
    "electricity/de-lu": {
      "unit": "USD/kWh",
      "source": "day-ahead auction, daily mean",
      "asOf": 1791590400,
      "stale": false,
      "points": [
        [
          1791504000,
          0.1021
        ],
        [
          1791590400,
          -0.0004
        ]
      ]
    },
    "electricity/aggregate": {
      "unit": "USD/kWh",
      "source": "day-ahead wholesale, 30-day mean of regions",
      "asOf": 1791590400,
      "stale": false,
      "points": [
        [
          1791504000,
          0.1021
        ],
        [
          1791590400,
          0.1019
        ]
      ]
    }
  }
}
